{
  "schema_version": 1,
  "candidate_key": "game:example-game",
  "snapshot_at": "2026-08-07T00:00:00Z",
  "site_url": "https://example-game.example",
  "gsc": {
    "setup_status": "not_started",
    "setup_mode": "existing",
    "property": null,
    "authorization_id": null,
    "readback_at": null,
    "data_status": "no_valid_data",
    "period": {"start": null, "end": null},
    "metrics": {}
  },
  "ga": {
    "setup_status": "not_started",
    "setup_mode": "existing",
    "property": null,
    "authorization_id": null,
    "readback_at": null,
    "data_status": "no_valid_data",
    "period": {"start": null, "end": null},
    "metrics": {}
  },
  "indexing": {
    "checked_at": null,
    "sitemap_url": null,
    "indexed_pages": null,
    "evidence": null
  },
  "observation": {
    "day": 0,
    "next_review_dates": [
      "2026-08-14T00:00:00Z",
      "2026-08-21T00:00:00Z"
    ],
    "technical_checks": []
  },
  "decision": {
    "recommendation": "none",
    "rationale": null,
    "approved_by": null,
    "approved_at": null
  },
  "template_readiness": {
    "approved": false,
    "reusable_scope": null,
    "product_specific_exclusions": null,
    "approved_by": null,
    "approved_at": null
  }
}
